source,url,job_id,title,company,location,salary_raw,salary_min,salary_max,salary_currency,skills,experience_raw,experience_min,experience_max,description,scraped_at,parse_status,posted_raw,posted_at,valid_through,location_cities,seniority,work_mode,employment_type,salary_period
itviec,https://itviec.com/it-jobs/senior-data-engineer-sql-data-warehousing-etl-bss-group-4606,itviec_senior-data-engineer-sql-data-warehousing-etl-bss-group-4606,Middle Data Engineer ( SQL/Data Warehousing/Python ),BSS Group,Hà Nội,You'll love it,,,,"Data Engineer, Business Analysis, Data modeling, Data Warehousing, Python, SQL, AWS, Azure, GCP",2–4 năm,2,4,"Top 3 Reasons To Join Us Open working environment to share and learn Competitive salary, Dynamic internal culture Focus on supporting personal growth The Job Data Engineering – Xây dựng và vận hành hạ tầng Thiết kế và vận hành pipeline ETL/ELT từ nhiều nguồn; Quản lý Data Warehouse; Tối ưu query bằng partitioning/indexing/caching; Đảm bảo chất lượng và giám sát dữ liệu. Data Analytics – Phân tích và báo cáo Xây dựng dashboard động (Power BI, Metabase, Tableau); Thực hiện cohort, funnel, segmentation; Tự động hóa báo cáo bằng SQL/Python; Đưa ra insight hỗ trợ quyết định kinh doanh. Business Analysis – Kết nối business và dữ liệu Thu thập và làm rõ yêu cầu từ stakeholder Viết tài liệu data requirements và data model Đề xuất cải tiến quy trình dựa trên dữ liệu. Your Skills and Experience 2–4 năm kinh nghiệm Data Engineering và/hoặc Data Analytics, ưu tiên công ty sản phẩm/SaaS Thành thạo SQL nâng cao (window functions, CTEs, optimization) Kinh nghiệm thiết kế pipeline ETL/ELT; sử dụng Airflow, dbt hoặc tương đương Làm việc được với Data Warehouse (BigQuery, Redshift, Snowflake…) Xây dựng và quản lý dashboard BI; phân tích được cohort, funnel, segmentation Giao tiếp tốt với non-technical stakeholder; viết tài liệu yêu cầu rõ ràng Có khả năng làm việc độc lập, tư duy hệ thống, ý thức về data quality & security Điểm cộng: kinh nghiệm cloud (GCP/AWS/Azure), product analytics, data governance, từng xây dựng hệ thống dữ liệu từ đầu. Why You'll Love Working Here Lương 18-20M gross, đánh giá tăng lương 2 lần/năm. Thời gian làm việc 5 ngày/tuần, từ 8h30 đến 17h45. Chính sách tài trợ học/thi các khóa học, chứng chỉ chuyên môn. Nhiều phúc lợi hấp dẫn: 13.5 ngày nghỉ phép/năm (12 ngày nghỉ phép theo quy định và 1.5 ngày nghỉ phép du lịch hàng năm), bảo hiểm, hiếu hỉ, quà sinh nhật, thưởng thâm niên và các phúc lợi khác theo quy định của pháp luật. Môi trường làm việc trẻ trung, làm hết sức, chơi hết mình. Văn phòng làm việc tiện nghi. Free trà, cafe và có tủ đồ uống. Tham gia các chương trình team building, dã ngoại, sinh nhật thành viên, du lịch, từ thiện… Nghỉ hằng năm và các phúc lợi khác theo quy định của pháp luật.",2026-06-30T09:03:17.326493+00:00,ok,2026-06-18,2026-06-18,2026-07-23,"Ho Chi Minh, Ha Noi, Da Nang",middle,remote,full_time,year
itviec,https://itviec.com/it-jobs/tmo-data-engineer-manager-sql-python-spark-kafka-ngan-hang-a-chau-acb-2231,itviec_tmo-data-engineer-manager-sql-python-spark-kafka-ngan-hang-a-chau-acb-2231,"TMO - Data Engineer Manager (SQL, Python, Spark, Kafka)",Ngân Hàng Á Châu | ACB,Hồ Chí Minh,You'll love it,,,,"Data Engineer, Python, GCP, SQL, Kafka, Spark, AWS, Azure",At least 7 years,7,,"Top 3 Reasons To Join Us 13 Monthly Base Salary Training Recorgnition The Job Design, build, and maintain scalable data infrastructure and pipelines that support banking operations, analytics, and regulatory compliance. This role bridges technical leadership with strategic business needs, ensuring data is accurate, secure, and accessible. Key Responsibilities: Data Architecture & Pipeline Development Design and implement robust, scalable data pipelines for structured and unstructured data. Oversee ETL/ELT processes to ingest data from core banking systems, CRM, and external sources. Ensure data models support real-time analytics, reporting, and machine learning. Collaborate with data scientists and analysts to provide usable, cleaned and aggregated data to end users Governance, Security & Compliance Ensure data practices comply with banking regulations (e.g., Basel III, GDPR, local laws). Implement data governance frameworks, including metadata management and lineage tracking. Collaborate with cybersecurity teams to safeguard sensitive financial data. Performance Optimization Monitor and optimize data infrastructure for performance, reliability, and cost-efficiency. Troubleshoot data issues and ensure high availability of data services. Innovation & Tooling Evaluate and adopt modern data technologies (e.g., cloud platforms, data lakes, streaming tools). Promote automation and DevOps practices in data engineering workflows. Your Skills and Experience Bachelor’s or Master’s in Computer Science, Data Engineering, or related field. At least 7 years in data engineering, with 2+ years in a leadership role. Strong experience with SQL, Python/Scala, Spark, Kafka, and cloud platforms (AWS/GCP/Azure). Familiarity with banking systems, financial data structures, and regulatory requirements. Excellent communication and stakeholder management skills. Why You'll Love Working Here • Average 15 Monthly Base salary per year • ACB Health Care. • Meal Allowance. • Preferential loan as regulated by ACB • Yearly Medical Checkup & Team building activities. • Professional and Transparent Working Environment",2026-06-30T09:03:21.542038+00:00,ok,2026-06-26,2026-06-26,2026-07-31,"Ho Chi Minh, Ha Noi, Da Nang",lead,remote,full_time,month
itviec,https://itviec.com/it-jobs/engineering-lead-python-ai-cloud-platform-skylink-labs-5029,itviec_engineering-lead-python-ai-cloud-platform-skylink-labs-5029,"Engineering Lead (Python, AI, Cloud Platform )",Skylink Labs,Hồ Chí Minh,3000 - 3500 USD,3000,3500,USD,"Leadership, AI, GCP, Cloud, AWS, Python, QA",,,,"Top 3 Reasons To Join Us The Job As Engineering Lead at Skylink Labs, you will own our backend systems and AI product development while mentoring the engineering team and shaping our technical direction. You will report directly to the CEO and work closely with Product, Design, and QA to deliver AI-powered experiences at scale. Your Skills and Experience Backend Development & System Ownership Design, develop, and maintain scalable backend services and APIs. Take ownership of existing backend systems and continuously improve performance, reliability, and maintainability. Troubleshoot complex production issues and support system stability. Participate in technical design discussions and architectural improvements. AI Product Development Integrate AI/LLM capabilities into production products. Work with AI services such as OpenAI, Gemini, Claude, AWS Bedrock, or similar platforms. Collaborate with Product and Engineering teams to deliver AI-powered user experiences. Evaluate technical solutions and recommend practical approaches to product challenges. Technical Leadership Mentor and support engineers within the team. Conduct code reviews and promote engineering best practices. Help establish development standards and improve team effectiveness. Collaborate with Product Managers, Designers, QA, and business stakeholders. Cloud & Platform Operations Deploy and maintain services on Google Cloud Platform (GCP). Monitor system performance and support operational excellence. Improve observability, logging, monitoring, and development workflows. Why You'll Love Working Here Attractive benefits for employees and their families, including health insurance, company trips, team building, happy hour, birthday celebrations, and more Full entitlements under the Labor Law after a 2-month probationary period Annual leave and public holidays in accordance with current labor regulations and company policies Access to social insurance (SI), health insurance (HI), unemployment insurance (UI), and annual health check-ups after probation A young, dynamic, modern, and professional work environment with a seasoned business team and numerous opportunities for personal growth Opportunities for training, skill development, and career advancement Various exclusive internal benefits and incentives under company policies Working Hours: Monday to Friday, 8:30 AM – 5:45 PM. Work location: An Khang Building, 28 Street 19, Binh Trung Ward, Ho Chi Minh City.",2026-06-30T09:03:24.599459+00:00,ok,2026-06-25,2026-06-25,2026-07-30,"Ho Chi Minh, Ha Noi, Da Nang",lead,hybrid,full_time,month
itviec,https://itviec.com/it-jobs/data-engineer-ai-python-sql-etl-english-up-to-3000-sun-group-3823,itviec_data-engineer-ai-python-sql-etl-english-up-to-3000-sun-group-3823,Data Engineer (AI/Python/SQL/ETL/English) up to $3000,Sun Group,Hà Nội,Up to $3000,,3000,USD,"Data Engineer, Big Data, AI, SQL, ETL, Python, AWS, Azure, GCP",5 năm,5,,"Top 3 Reasons To Join Us “An cư lạc nghiệp”- housing support for long-term Competitive salary and benefits Exclusive perks across Sun Group’s ecosystem The Job Data Engineer Bạn không chỉ xây dựng data pipeline. Bạn sẽ là người định hình kiến trúc dữ liệu cho một trong những hệ sinh thái dữ liệu quy mô lớn nhất Việt Nam, phục vụ hàng triệu giao dịch và hàng chục đơn vị thành viên của Sun Group. Đây là cơ hội dành cho những Data Engineer yêu thích giải quyết các bài toán lớn, mong muốn xây dựng nền tảng dữ liệu hiện đại từ đầu và tạo ra những hệ thống có khả năng mở rộng trong nhiều năm tới. CÔNG VIỆC Thiết kế kiến trúc dữ liệu hiện đại Thiết kế mô hình dữ liệu cho Data Lakehouse, Data Warehouse và các hệ thống lưu trữ dữ liệu vận hành. Xây dựng kiến trúc dữ liệu có khả năng mở rộng, hiệu năng cao và đáp ứng nhu cầu phát triển lâu dài của doanh nghiệp. Đề xuất và xây dựng roadmap công nghệ cho toàn bộ nền tảng dữ liệu. Xây dựng hệ thống Data Platform Thiết kế các pipeline ETL/ELT tối ưu cho nhiều nguồn dữ liệu khác nhau (CRM, hệ thống nội bộ, nền tảng du lịch, mạng xã hội...). Đảm bảo dữ liệu luôn sẵn sàng, chính xác và dễ dàng khai thác cho các bài toán phân tích và AI. Tối ưu hiệu năng xử lý dữ liệu ở quy mô lớn. Dẫn dắt về mặt kỹ thuật Mentor và hỗ trợ đội ngũ Data Engineer trong các bài toán kỹ thuật phức tạp. Đưa ra các tiêu chuẩn về thiết kế, phát triển và vận hành hệ thống dữ liệu. Đồng hành cùng đội ngũ trong việc tối ưu pipeline, xử lý sự cố và nâng cao chất lượng nền tảng. Data Governance & Security Xây dựng tiêu chuẩn quản trị dữ liệu về chất lượng, metadata, lineage và bảo mật. Thiết kế mô hình phân quyền truy cập, masking và bảo vệ dữ liệu theo tiêu chuẩn doanh nghiệp. Đồng hành cùng Business Phối hợp với Ban lãnh đạo và các đơn vị nghiệp vụ để chuyển đổi nhu cầu kinh doanh thành giải pháp dữ liệu khả thi. Đánh giá và ứng dụng các công nghệ dữ liệu mới nhằm liên tục nâng cấp hệ sinh thái Data Platform. Your Skills and Experience Bắt buộc Có từ 5 năm kinh nghiệm trong lĩnh vực Data Engineering. Đã từng thiết kế và triển khai Data Platform trên AWS, Azure hoặc GCP . Thành thạo thiết kế Data Lakehouse hoặc Data Mesh. Có kinh nghiệm về: Data Modeling (Kimball, Data Vault...) SQL chuyên sâu Python hoặc Scala Apache Spark (PySpark/Scala) Airflow Hiểu rõ Data Governance, Data Quality và Metadata Management. Có khả năng truyền đạt, dẫn dắt kỹ thuật và phối hợp hiệu quả với cả đội ngũ kỹ thuật lẫn business. Ưu tiên Đã từng xây dựng Data Platform từ giai đoạn đầu (Greenfield Project). Có kinh nghiệm xử lý dữ liệu streaming với Kafka hoặc Kinesis. Có các chứng chỉ Cloud Data Engineer/Data Architect. Hiểu về DataOps, MLOps hoặc CI/CD cho Data Platform. Why You'll Love Working Here ✨ Tham gia xây dựng nền tảng dữ liệu cốt lõi cho hành trình chuyển đổi số của Sun Group. ✨ Làm việc với các công nghệ Cloud và Big Data hiện đại trên những hệ thống dữ liệu quy mô lớn. ✨ Đồng hành cùng đội ngũ Data Engineer, Architect và Data Analyst giàu chuyên môn trong môi trường đề cao đổi mới và chia sẻ kiến thức. Phúc lợi nổi bật Chính sách ""An cư lạc nghiệp"" dành cho nhân sự gắn bó lâu dài. Bảo hiểm sức khỏe SunCare cho nhân viên và người thân. Khám sức khỏe định kỳ tại Bệnh viện Quốc tế Sun Group. Nhiều ưu đãi đặc biệt dành cho nhân viên: Vé công viên và cáp treo Nghỉ dưỡng tại hệ thống khách sạn, resort Ưu đãi bất động sản Ưu đãi hàng không Và nhiều chương trình phúc lợi hấp dẫn khác.",2026-06-30T09:03:28.856899+00:00,ok,2026-06-18,2026-06-18,2026-07-23,"Ho Chi Minh, Ha Noi, Da Nang",senior,remote,full_time,year
itviec,https://itviec.com/it-jobs/consultant-fullstack-engineer-python-reactjs-nab-innovation-centre-vietnam-0039,itviec_consultant-fullstack-engineer-python-reactjs-nab-innovation-centre-vietnam-0039,"Consultant, Fullstack Engineer (Python/ ReactJS)",NAB Innovation Centre Vietnam,Hồ Chí Minh,You'll love it,,,,"Python, DevOps, Security, React, AWS, Azure",5-6 years,5,6,"Top 3 Reasons To Join Us Very competitive remuneration package Build products for millions of users in Australia Hybrid and flexible working environment The Job Be part of our Group Security team and help design and build modern, secure web applications that protect and enable the organization at scale. As a Fullstack Engineer, you will work with Python and React to deliver high-quality solutions, while also stepping into a leadership role to guide team members and champion secure engineering practices. JOB RESPONSIBILITIES Full Stack with deep expertise in either Frontend (React, TypeScript) or Backend (REST APIs, Python FastAPI); working knowledge of the other side is sufficient Deep knowledge of Secure Software Development (SAST, OWASP, dependency scanning) Familiarity with Cloud, DevOps tools (Harness CI/CD, AWS/Azure, Kubernetes, IaC) to build, deploy, and manage applications and services. Team leadership (code reviews, mentoring, sprint planning Collaborate with other teams to develop and deploy cloud-based solutions. Troubleshoot, debug, and resolve technical issues related to cloud infrastructure and databases. Continuously explore and adopt new technologies to improve system performance and efficiency. Your Skills and Experience YOUR SKILLS & EXPERIENCE Having 5-6 years of experience in application development and support roles. At least 1 year experience in building pipelines using an automation tool, like Jenkins. CI/CD – Good understanding of CI/CD concepts and working knowledge of building pipelines using at least one automation tool. Proven experience in AWS/ Azure DevOps implementations. (Terraform, Cloud-formation, Ansible, Jenkins) Adopt to Rally for features and stories with effort estimation for Development activity and track completion of stories within sprints Good English communication skills Excellent Knowledge of Agile practices and SDLC principles. High level of proficiency in cloud-based applications in AWS Excellent documentation and communication skills including proven ability to build working relationships with a broad range of stakeholders across different functions, locations, and seniorities. Ability to understand and challenge status quo, propose solutions, gain stakeholder buy in and execute to agreed resolution. Why You'll Love Working Here THE BENEFITS AND PERKS 1. Generous compensation and benefit package Attractive salary and benefits 20-day annual leave and 7-day sick leave, etc. 13th month salary and Annual Performance Bonus Premium healthcare for yourself and family members Monthly allowance for team activities Premium welcome kit and frequent appreciation gifts Extra benefits for long-term employees 2. Exciting career and development opportunities Large scale products with modern technologies in banking domain Clear roadmap for career advancement in both technical and leadership pathways Well-structured learning and development programs (technical and soft skills) Sponsored certificates in both IT and banking/finance Premium account on Udemy English learning with native teachers Opportunity for traveling & training in Australia 3. Professional and engaging working environment Hybrid working model and good work-life balance Well-equipped & modern Agile office with fully stocked pantry Special programs to improve your physical and mental health Annual company trip and events A solid talented team behind you – great people who love what they do If this excites you, let's have a chat over a cup of coffee!",2026-06-30T09:03:32.518339+00:00,ok,2026-06-17,2026-06-17,2026-07-22,"Ho Chi Minh, Ha Noi, Da Nang",senior,remote,full_time,month
itviec,https://itviec.com/it-jobs/junior-devops-engineer-python-aws-cloud-k8s-opencommerce-group-3748,itviec_junior-devops-engineer-python-aws-cloud-k8s-opencommerce-group-3748,"Junior DevOps Engineer (Python, AWS, Cloud, K8s)",OpenCommerce Group,Hà Nội,800 - 1200 USD,800,1200,USD,"DevOps, Cloud, Python, Kubernetes, AWS, CI/CD, GCP, Docker",tối thiểu 2 năm,2,,"Top 3 Reasons To Join Us Làm việc với các đội ngũ trẻ tài năng và máu lửa Môi trường làm việc thoải mái, năng động Sản phẩm của người Việt chinh phục toàn cầu The Job Quản lý, vận hành và duy trì hạ tầng cloud và on-premise, đảm bảo tính sẵn sàng cao (high availability), khả năng mở rộng (scalability) và bảo mật. Duy trì và cải tiến các hệ thống quản lý cấu hình (Configuration Management) cũng như các quy trình triển khai hạ tầng theo mô hình Infrastructure as Code (IaC). Xây dựng, triển khai và duy trì các chiến lược sao lưu dữ liệu (backup) và khôi phục sau thảm họa (disaster recovery). Thiết kế, xây dựng và vận hành các quy trình CI/CD (Continuous Integration/Continuous Delivery) nhằm tự động hóa việc phát triển và triển khai phần mềm. Thiết kế và triển khai các hệ thống giám sát (monitoring), ghi log (logging) và cảnh báo (alerting) để đảm bảo hiệu năng, tính ổn định và sức khỏe của ứng dụng cũng như hạ tầng. Tự động hóa các tác vụ vận hành nhằm nâng cao hiệu quả công việc và giảm thiểu sự can thiệp thủ công. Phối hợp với các phòng ban và đội ngũ liên quan để xử lý, khắc phục các sự cố và vấn đề liên quan đến hạ tầng hệ thống. Your Skills and Experience Tốt nghiệp Đại học chuyên ngành Khoa học Máy tính, Công nghệ Thông tin, Kỹ thuật hoặc các lĩnh vực liên quan (hoặc có kinh nghiệm thực tế tương đương). Có tối thiểu 2 năm kinh nghiệm ở vị trí DevOps, SecOps hoặc các vị trí tương đương, ưu tiên tại các dự án/công ty product. Có kinh nghiệm thực hành cơ bản hoặc kiến thức nền tảng về các nền tảng Cloud như AWS, GCP. Có hiểu biết cơ bản về các công cụ Infrastructure as Code (IaC) như Terraform hoặc CloudFormation. Quen thuộc với các công cụ quản lý cấu hình như Ansible. Nắm được các khái niệm về CI/CD và có kinh nghiệm sử dụng một số công cụ như Jenkins, GitLab CI/CD. Có kiến thức cơ bản về các công cụ Monitoring và Logging như Prometheus, Grafana, ELK Stack,... Có kinh nghiệm làm việc với các công nghệ Containerization và Orchestration như Docker và Kubernetes, bao gồm việc sử dụng Helm để quản lý package và Kustomize để tùy chỉnh cấu hình. Có kỹ năng lập trình/scripting cơ bản với các ngôn ngữ như Bash hoặc Python. Có kỹ năng giao tiếp, phối hợp và làm việc nhóm tốt. Why You'll Love Working Here Chúng tôi xây dựng môi trường làm việc nơi con người được trân trọng, ghi nhận và phát triển bền vững. Thu nhập & Thưởng: Mức lương NET cạnh tranh, chi trả minh bạch, thu nhập thực nhận rõ ràng: 800 - $1200 Thu nhập lên tới 16 tháng lương/năm, gồm lương tháng 13 cố định, thưởng hiệu suất kinh doanh theo quý lên đến 02 tháng lương/năm, dựa trên kết quả cá nhân và công ty Thời gian làm việc & Nghỉ ngơi: 24 ngày làm việc từ xa mỗi năm, linh hoạt và chủ động 12 ngày phép năm, cộng thêm các ngày nghỉ lễ theo quy định Giờ làm việc linh hoạt, từ Thứ 2 đến Thứ 6, đảm bảo cân bằng công việc – cuộc sống Chăm sóc sức khỏe & Phúc lợi: Khám sức khỏe định kỳ hằng năm Đóng BHXH đầy đủ theo quy định pháp luật Câu lạc bộ thể thao nội bộ (Cầu lông, bóng đá,...) khuyến khích lối sống lành mạnh Du lịch công ty, hoạt động gắn kết đội ngũ được tổ chức thường xuyên Phát triển sự nghiệp & Môi trường làm việc: Cơ hội làm việc trong môi trường Global B2B SaaS đang tăng trưởng nhanh Lộ trình phát triển và thăng tiến rõ ràng, tốc độ nhanh dựa trên năng lực Làm việc cùng đội ngũ chuyên nghiệp và giàu kinh nghiệm Không gian làm việc hiện đại, cởi mở, đề cao sự tin tưởng, trao quyền và phát triển con người Chúng tôi tin rằng một môi trường làm việc tốt không chỉ giúp bạn thành công trong sự nghiệp, mà còn đồng hành cùng bạn trên hành trình phát triển dài hạn.",2026-06-30T09:03:35.903555+00:00,ok,2026-06-23,2026-06-23,2026-07-28,"Ho Chi Minh, Ha Noi, Da Nang",junior,remote,full_time,month
