source,url,job_id,title,company,location,salary_raw,salary_min,salary_max,salary_currency,skills,experience_raw,experience_min,experience_max,description,scraped_at,parse_status,posted_raw,posted_at,valid_through,location_cities,seniority,work_mode,employment_type,salary_period
itviec,https://itviec.com/it-jobs/java-developer-fpt-software-0000,itviec_java-developer-fpt-software-0000,Java Developer,FPT Software,Hồ Chí Minh,You'll love it,,,,"Java, Spring Boot, Spring",At least 2 years,2,,"Top 3 Reasons To Join Us Global Exposure Fast Track Career Diversified Jobs & Technologies The Job ABOUT FPT SOFTWARE FPT Software, a subsidiary of FPT Group, is a leading global IT service provider headquartered in Vietnam. With 33,000+ employees in 88 offices across 30 countries, we serve 1,100+ clients, including 96 Fortune 500 companies. We believe diversity fuels innovation and strive to create an inclusive workplace where talents of all backgrounds thrive. We welcome expatriates and international professionals to bring fresh perspectives and help shape the future of technology. RESPONSIBILITIES Work with team to maintain Application of the Japan customer. Customization Java base application. Integration with external system. Optimization application to improve performance. Report to Team leader. Your Skills and Experience At least 2 years experience in Java programming language Understanding of Spring Excellent working attitude, problem solving, critical thinking and communication skills. Passionate about programming, innovation, and solving challenging problems. Why You'll Love Working Here Successful candidates will be part of a friendly, motivated and committed talent teams with various benefits and attractive offers: Attractive offer, plus annual compensation and performance bonus. FPT Care insurance plan tailored for FPT employees. Support for learning and certificate examination. Company shuttle buses provide convenient way of transportation for all employees. Salary review 1 time/year or on excellent performance Annual Summer Vacation: follows company’s policy and starts from May every year International, dynamic, friendly working environment Annual leave, working conditions follow Vietnam labor laws. Other allowances: transportation allowance, lunch allowance, working on-site allowance, etc. FTown Campus provide many facilities for FPT employees such as football ground, basketball & volleyball, gym & yoga centre, restaurant, cafeteria, etc.",2026-06-30T09:04:18.281030+00:00,ok,2026-06-12,2026-06-12,2026-07-17,"Ho Chi Minh, Ha Noi, Da Nang",middle,hybrid,full_time,year
itviec,https://itviec.com/it-jobs/c-developer-jp-n3-fpt-software-0354,itviec_c-developer-jp-n3-fpt-software-0354,C++ Developer (JP N3+),FPT Software,Hồ Chí Minh,0 - 500 USD,0,500,USD,"C++, Database, Windows, .NET, OOP, Japanese, Internship Accepted, SQL",fresher,0,1,"Top 3 Reasons To Join Us Global Exposure Fast Track Career Diversified Jobs & Technologies The Job FPT Software HCM đang tìm kiếm các bạn sinh viên đã/sắp tốt nghiệp để tham gia vào các dự án phát triển phần mềm với quy mô lớn. Có cơ hội học tập và làm việc trong các dự án với các khách hàng lớn của công ty, được học hỏi về mô hình và các phương pháp phát triển phần mềm như Waterfall, Agile, Scrum... Your Skills and Experience Sinh viên đã hoặc sắp tốt nghiệp chuyên ngành CNTT, Công nghệ phần mềm, Kỹ thuật máy tính hoặc các chuyên ngành liên quan,… Nắm vững kiến thức lập trình căn bản: OOP; cấu trúc cơ sở dữ liệu và giải thuật... Có kinh nghiệm và yêu thích về ngôn ngữ lập trình C/C++, Window Application: ASP.Net Web API, networking, relational database (SQL, Postgre...); .Net/.Net Core framework, Entity Framework/entity framework core. Có kiến thức về một trong những lĩnh vực sau là một lợi thế: Desktop Application programming, Image processing, multi-threading, multi processing... Có thể sử dụng Git tool, có kiến thức về Agile/Scrum là một lợi thế. Có khả năng đọc hiểu & giao tiếp tiếng Nhật tốt tương đương JLPT N3 trở lên. Tham gia đào tạo/làm việc Full-time từ Thứ 2 - Thứ 6 (8h00-17h00). Why You'll Love Working Here Cơ hội nghề nghiệp toàn cầu cùng FPT. Phát triển chuyên môn thông qua các dự án quốc tế, quy mô “triệu đô”. Lộ trình đào tạo, phát triển nghề nghiệp bài bản, rõ ràng. Đãi ngộ đặc biệt: Mức thu nhập hấp dẫn. Hỗ trợ phát triển chuyên môn, thi chứng chỉ quốc tế, kỹ năng mềm… Trải nghiệm môi trường làm việc #LifeAtFPT đặc sắc với vô vàn hoạt động hấp dẫn.",2026-06-30T09:04:21.551567+00:00,ok,2026-06-18,2026-06-18,2026-07-23,"Ho Chi Minh, Ha Noi, Da Nang",junior,hybrid,full_time,year
itviec,https://itviec.com/it-jobs/data-analyst-sql-python-cong-ty-co-phan-noi-that-va-xay-dung-sao-moc-vuong-0749,itviec_data-analyst-sql-python-cong-ty-co-phan-noi-that-va-xay-dung-sao-moc-vuong-0749,"Data Analyst (SQL, Python)",CÔNG TY CỔ PHẦN NỘI THẤT VÀ XÂY DỰNG SAO MỘC VƯƠNG,Hà Nội,You'll love it,,,,"Data Analysis, Data Warehousing, Power BI, Python, SQL",1 năm,1,,"Top 3 Reasons To Join Us The Job Chúng tôi đang tìm kiếm một Data Analyst có tư duy phân tích và định hướng kinh doanh để giúp công ty khai thác dữ liệu hiệu quả, đưa ra các báo cáo và insight hỗ trợ quá trình ra quyết định. Trách nhiệm chính 1. Thu thập và xử lý dữ liệu Thu thập dữ liệu từ Database, API, Google Analytics, CRM và các nguồn dữ liệu khác. Làm sạch, chuẩn hóa và kiểm tra chất lượng dữ liệu. Xây dựng quy trình ETL cơ bản. 2. Xây dựng Dashboard và Báo cáo Thiết kế và phát triển Dashboard theo nhu cầu của các phòng ban. Theo dõi và phân tích các chỉ số: Doanh thu Người dùng Marketing Hiệu suất vận hành Tự động hóa các báo cáo định kỳ. 3. Phân tích dữ liệu Phân tích hành vi người dùng. Tìm kiếm các xu hướng, bất thường trong dữ liệu. Đưa ra các insight và đề xuất cải tiến dựa trên dữ liệu. 4. Xây dựng KPI Phối hợp với các phòng ban xây dựng: KPI kinh doanh KPI sản phẩm KPI vận hành Thiết lập hệ thống theo dõi và cảnh báo. 5. Hỗ trợ ra quyết định Phân tích hiệu quả của các chiến dịch. Đánh giá hiệu quả của các tính năng sản phẩm. Hỗ trợ Ban lãnh đạo trong việc ra quyết định dựa trên dữ liệu. Your Skills and Experience Bắt buộc Có từ 1 năm kinh nghiệm ở vị trí Data Analyst hoặc tương đương. Thành thạo SQL: JOIN Window Function CTE Query Optimization Thành thạo Excel hoặc Google Sheets. Thành thạo một trong các công cụ: Power BI Tableau Metabase Looker Studio Có khả năng phân tích và trình bày dữ liệu. Ưu tiên Biết Python: Pandas Numpy Matplotlib Có kiến thức về: Data Warehouse ETL Data Modeling Có kinh nghiệm với: Google Analytics Firebase Analytics Mixpanel Amplitude Có kinh nghiệm làm việc trong công ty công nghệ hoặc SaaS. KỸ NĂNG MỀM Tư duy logic và phản biện. Kỹ năng giao tiếp tốt. Kỹ năng trình bày dữ liệu và storytelling. Chủ động và có tinh thần học hỏi. Có khả năng làm việc độc lập và làm việc nhóm. Why You'll Love Working Here Lương cạnh tranh theo năng lực. Thưởng dự án, thưởng hiệu suất. Xét tăng lương định kỳ. Được đào tạo về nghiệp vụ và công nghệ. Môi trường làm việc trẻ, năng động. Tham gia BHXH, nghỉ phép và các chế độ theo quy định",2026-06-30T09:04:25.250715+00:00,ok,2026-06-30,2026-06-30,2026-08-04,"Ho Chi Minh, Ha Noi, Da Nang",junior,remote,full_time,year
itviec,https://itviec.com/it-jobs/software-developer-javascript-python-cennext-co-ltd-1105,itviec_software-developer-javascript-python-cennext-co-ltd-1105,"Software Developer (JavaScript, Python)","CENNEXT CO., LTD",Hà Nội,You'll love it,,,,"Python, ETL, Linux, AI, JavaScript, Docker, SQL",,,,"Top 3 Reasons To Join Us The Job Chúng tôi tìm kiếm một Python/Javascript Developer có khả năng làm việc hiệu quả trong môi trường đổi mới liên tục, và sẵn sàng thay đổi và tối ưu công việc khi nhận feedback từ team. Cụ thể có kinh nghiệm trong các công việc sau: Web Scraping: Phát triển và duy trì các công cụ thu thập dữ liệu từ Website và API. ETL Pipeline: Xây dựng và tối ưu hóa các quy trình xử lý dữ liệu. AI Agent: Tích hợp và phát triển các agent tự động hóa công việc sử dụng AI (OpenAI, Langchain, Cursor AI…). Workflow Automation: Xử lý các tác vụ tự động hóa và quản lý job queue bằng Python hoặc Javascript (trên trình duyệt). Triển khai các hệ thống lên server Linux sử dụng Docker và Git. Your Skills and Experience Tốt nghiệp đại học chuyên ngành CNTT, Khoa học máy tính hoặc có kinh nghiệm liên quan. Python: Thành thạo các thư viện như Requests, BeautifulSoup, Pandas, Asyncio, và Selenium, Playwright. Kinh nghiệm làm ETL pipeline và xử lý dữ liệu trên cơ sở dữ liệu SQL/NoSQL. Kinh nghiệm với AI Agents, API, hoặc tự động hóa quy trình bằng AI. Windows, Linux, Docker, Git: Có thể triển khai và duy trì hệ thống. Có tư duy chủ động, khả năng làm việc độc lập. Đam mê phát triển cá nhân và có thể thay đổi để cải thiện chất lượng công việc. Ưu tiên thêm nếu có: Kinh nghiệm thực tế với các dự án Web Scraping và Data Automation. Biết về Cursor AI, MCP Server, hoặc các công cụ tương tự. Đã từng có repo GitHub hoặc sản phẩm Demo. Why You'll Love Working Here Mức lương thỏa thuận theo năng lực. Thưởng cuối tháng theo năng lực, thưởng lễ, Tết, sinh nhật. Thưởng lương tháng 13, xét tăng lương định kỳ hàng năm, tăng lương đột xuất theo năng lực. Được đào tạo để phục vụ công việc, tham gia khóa học tiếng anh giao tiếp Cung cấp đầy đủ trang thiết bị làm việc tại Văn phòng. Được hưởng đầy đủ các chính sách BHXH, BHYT, BHTN theo Luật lao động của Nhà nước. Cơ hội làm việc với các công nghệ hiện đại: AI, Automation, Scalable Systems.. Thời gian: Từ 7:00 - 16:00, nghỉ cuối tuần (04 ngày Chủ nhật và 02 ngày thứ Bảy). Địa điểm: Lựa chọn 1 trong các địa điểm làm việc phù hợp sau: Cơ sở 1: 22 Thành Công, Phường Giảng Võ, Hà Nội Cơ sở 2: 02 Nguyễn Hoàng, Phường Từ Liêm, Hà Nội Cơ sở 3: 150 Nguyễn Xí, Phường Bình Thạnh, TP. Hồ Chí Minh",2026-06-30T09:04:29.551398+00:00,ok,2026-06-30,2026-06-30,2026-08-04,"Ho Chi Minh, Ha Noi, Da Nang",,hybrid,full_time,month
itviec,https://itviec.com/it-jobs/senior-engineer-python-fastapi-aws-lg-cns-viet-nam-3610,itviec_senior-engineer-python-fastapi-aws-lg-cns-viet-nam-3610,"Senior Engineer (Python FastAPI, AWS)",LG CNS Việt Nam,Hà Nội,You'll love it,,,,"Python, AWS, Docker, Kubernetes",7–9 years,7,9,"Top 3 Reasons To Join Us Salary and bonus based on ability Young and fun working environment Opportunities to study and work abroad. The Job 1. Mission - As a Senior Engineer (Python, AWS) and Technical Leader, you will lead the design, development, and delivery of scalable enterprise applications. - You will be responsible for system backend development using Python(FastAPI), and guiding the engineering team in architecture decisions, best practices, and delivery excellence. - You will play a key role in aligning technical solutions with business goals, mentoring engineers, and ensuring high-quality, scalable, and maintainable systems. 2. Responsibilities - Lead the analysis, design and development of systems using Python(FastAPI). - Architect scalable, maintainable, and high-performance systems. - Provide technical leadership, mentorship, and code reviews for engineering team members. - Define and enforce best practices in coding standards, system design, and development workflows. - Collaborate with product managers, designers, and stakeholders to translate business requirements into technical solutions. - Design and implement RESTful APIs and integrate with frontend applications. - Ensure application performance, security, scalability, and reliability. - Lead troubleshooting, debugging, and optimization in production environments. - Participate in system design discussions and long-term technical roadmap planning. - Improve development processes, CI/CD pipelines, and engineering productivity. Your Skills and Experience Mandatory Requirements - 7–9 years of experience in software development. - Strong understanding and experience in system architecture, analysis, design, and scalability. - Strong experience with Python and FastAPI framework in production systems. - Strong experience in Async programming - Experience in ORM: SqlAlchemy, JPA - Experience in DB management: Alembic, flyway - Proven experience in technical leadership or team lead role. - Strong communication skills in English (both written and verbal). - Experience working in agile development environments. - Strong problem-solving skills and ability to drive technical decisions. Nice to Have - Experience in resolving problem of Application and Cloud resources - Experience in Digital Marketing domain - Experience in Kubernetes, Docker/Container, AWS Debugging - Experience in AWS Cognito/AWS S3/AWS SES/AWS Lambda - Experience with performance tuning and system optimization. - Experience working in multinational or global teams. Why You'll Love Working Here - Best remuneration : Periodically review and adjust salary once a year, PI bonus twice a. Allowances for lunch, transportation, and phone charges. Party with the team once a. Workshop travel for the whole company once a year. Bonuses/Gifts for holidays, International Labor Day, International Women's Day, etc. - High-class, modern office : 5-star standard office with modern equipment, large rest and entertainment areas (game area, karaoke room, reading room, cafe counter, snack bar, etc.) Meet all members' needs, especially the office has an airy and beautiful view that is among the most beautiful in Hanoi. - Top equipment : Each employee is equipped with the latest generation LG Gram laptop and modern large LG screen. - Best working time : Work 8 hours/day (8:00 ~ 17:00), from Monday to Friday. No pressure to work overtime/weekends! - Flexible, youthful working style : LG CNS Vietnam members are mostly from the 9-10x generation, with a youthful, modern, and fair working style! - Creative environment, valuing individual opinions : With a young and talented team, we always appreciate the creativity and suggestions that members make. - Opportunities to work/study in Korea and abroad : With customers and projects mostly from abroad, your opportunities for training and onsite abroad will always be open! - Other : Happy hours every Friday, Team outing monthly, join clubs like football, badminton, etc...",2026-06-30T09:04:32.650699+00:00,ok,2026-06-15,2026-06-15,2026-07-20,"Ho Chi Minh, Ha Noi, Da Nang",senior,remote,full_time,month
itviec,https://itviec.com/it-jobs/hybrid-backend-engineer-python-django-fastapi-cong-ty-tnhh-renda-4856,itviec_hybrid-backend-engineer-python-django-fastapi-cong-ty-tnhh-renda-4856,"[Hybrid] Backend Engineer (Python, Django/FastAPI)",Công ty TNHH RENDA,Hồ Chí Minh,1000 - 1500 USD,1000,1500,USD,"Python, HTML, ETL, FastAPI, PostgreSQL, Django, React, Kubernetes",4 years,4,,"Top 3 Reasons To Join Us The Job Design & build RESTful APIs using Django / FastAPI Work closely with frontend team to design clean, scalable API contracts Develop and maintain ETL pipelines , Handle async processing with Celery Optimize database queries for large datasets Implement caching strategies (Redis) for performance Ensure system reliability when integrating external e-commerce APIs Your Skills and Experience > 4 years experience with Python backend (Django / FastAPI) Strong experience with PostgreSQL Experience with Celery or background job processing Hands-on experience with ETL/ELT workflows, Batch & incremental sync Basic knowledge of HTML, CSS, React, Next.js Nice to Have Message brokers (RabbitMQ / Kafka is a plus) Familiarity with Airflow, ClickHouse, dbt is a plus Experience with GitLab CI/CD, Kubernetes is a plus Experience working with e-commerce APIs is a strong advantage Why You'll Love Working Here Mức lương: 25–35 triệu gross/tháng Thưởng lương tháng 13 Đóng BHXH đầy đủ theo quy định Làm việc hybrid, 2-3 ngày văn phòng / tuần Hỗ trợ $100/tháng cho Vibe Coding tools (Cursor, Antigravity, v.v.) Môi trường startup product-driven, xây dựng SaaS platform phân tích dữ liệu e-commerce (Shopee, Tiktokshop) từ zero-to-one — cơ hội contribute trực tiếp vào kiến trúc hệ thống và hướng phát triển sản phẩm",2026-06-30T09:04:37.104485+00:00,ok,2026-06-22,2026-06-22,2026-07-27,"Ho Chi Minh, Ha Noi, Da Nang",middle,hybrid,full_time,month
itviec,https://itviec.com/it-jobs/senior-data-scientist-ml-ai-mlops-python-pytorch-tekai-1935,itviec_senior-data-scientist-ml-ai-mlops-python-pytorch-tekai-1935,"Senior Data Scientist (ML/AI, MLOps, Python, PyTorch)",Tekai,Hà Nội,You'll love it,,,,"Data Science, Python, MLOps, PyTorch, Machine Learning, AI",5+ years,5,,"Top 3 Reasons To Join Us The Job About This Role We're looking for a Senior Data Scientist specializing in AI and Computer Vision to join Tekai's growing team of specialists. You'll work end-to-end on real-world AI projects — from translating business problems into solution architectures, to building and deploying state-of-the-art computer vision models in production. This role is for someone with deep ML foundations, hands-on CV experience, and the mindset to take ownership of complex technical challenges in close collaboration with customers and cross-functional teams. What You Will Do Collaborate with data scientists, engineers, customers, and partners across the full lifecycle of AI projects. Translate business and operational needs into AI solution architectures and production-ready ML systems. Design, build, and deploy modern computer vision models using deep learning, foundation models, transfer learning, and self-/weakly-supervised approaches. Build and manage scalable data pipelines, annotation workflows, and dataset lifecycle processes. Validate and test models for robustness and reliability in production environments. Your Skills and Experience Technical Skills 5+ years of experience building and deploying ML/AI solutions, with strong computer vision expertise (PyTorch, deep learning architectures, transfer learning). End-to-end CV system development: detection, segmentation, alignment, anomaly detection, and visual inspection. MLOps and ML engineering: experiment tracking, model versioning, reproducibility, and production deployment pipelines. Data and annotation management: pipeline design, quality control, dataset structuring, augmentation, and large-scale image handling. Strong Python and Linux-based development skills Git-based collaboration workflows. MSc or PhD in Computer Science, Data Science, Engineering, or a related field Bonus: Experience with metric learning, similarity-based modeling, or industrial AI applications under real-world constraints. Soft Skills Strong problem-solving and analytical skills Excellent communication skills in English (preferred TOEIC 750+ or IELTS 6.5+) Proactive, self-motivated, and detail-oriented Why You'll Love Working Here BENEFIT At Tekai Vietnam, we build a working environment based on trust, proactiveness, transparency, and respect for individuals, reflecting the cultural integration between Vietnam and Finland. COMPENSATION & BENEFITS Salary review 1–2 times per year, based on performance, level of contribution, and role maturity. A minimum of 13 months’ salary per year, along with performance bonuses, business performance bonuses, and bonuses for public holidays, Lunar New Year, and other special occasions. Annual company trips and team-building activities, organized with a focus on balance and internal connection. Full social insurance coverage (SI, HI, UI) in accordance with regulations, along with periodic health check-ups. Extended health insurance package (applied after one year of employment). Provision of full working equipment and tools, supporting job requirements and individual productivity. WORK-LIFE BALANCE Weekly Happy Time every Friday, creating space for connection, sharing, and recharging. Employee welfare fund established by the company to support and accompany employees through important life events (meals, birthdays, marriage, childbirth, illness, etc.). WORKING ENVIRONMENT & DEVELOPMENT An open working environment with cultural integration between Finland and Vietnam, encouraging open communication, two-way feedback, and proactive solution proposals. Management by objectives and results, empowering employees and allowing them to organize their work in the way that suits them best. A strong emphasis on work–life balance, prioritizing quality and a sustainable working pace. LOCATION & WORKING HOURS Location: Dong Do Apartment Building, Nghia Do Street, Nghia Do Ward, Hanoi. Working days: 5 days per week, 7.5 working hours per day, from 9:00 AM to 6:00 PM, Monday to Friday (including a 1.5-hour lunch break). Days off: Saturdays, Sundays, and Vietnamese public holidays.",2026-06-30T09:04:41.715328+00:00,ok,2026-06-20,2026-06-20,2026-07-25,"Ho Chi Minh, Ha Noi, Da Nang",senior,onsite,full_time,year
