source,url,job_id,title,company,location,salary_raw,salary_min,salary_max,salary_currency,skills,experience_raw,experience_min,experience_max,description,scraped_at,parse_status,posted_raw,posted_at,valid_through,location_cities,seniority,work_mode,employment_type,salary_period
itviec,https://itviec.com/it-jobs/backend-engineer-java-python-aws-gotymex-3136,itviec_backend-engineer-java-python-aws-gotymex-3136,"Backend Engineer - (Java/Python, AWS)",GoTymeX,Hồ Chí Minh,You'll love it,,,,"Java, Agile, Database, English, AWS, Python, Docker, Kubernetes, Redis",5 years,5,,"Top 3 Reasons To Join Us Excellent environment and team to help you grow. Competitive salary and learning culture. Premium health care for you and your family. The Job About our Team: Our team is responsible for creating a brand new suite of digital financial platforms and apps that are highly reliable and scalable, using modern engineering practices. You will be joining a project with talented software engineers in our Digital Bank Build team, who are responsible for designing, building, and maintaining the new digital banking platform and its customer channels. As part of the team, you will implement software features, participate in technical designs, and write tests to ensure high-quality product delivery. Our teams operate in Scrum and DevOps models. We’re looking for top engineers! During the interview process, we will assess your coding and design skills to evaluate your experience and depth of knowledge. Don’t worry, our interview process will be engaging! Responsibilities: As a Backend Engineer, you will work on specific problem domains, designing, developing, and deploying backend services with a focus on scalability, high availability, and low latency. Drive the efficient delivery of change through analysis, definition, and documentation of requirements, while identifying potential solutions using agile delivery frameworks. Solve complex technical and business problems and learn new technologies and frameworks. Be part of a team that takes full responsibility for the features you own. Design, develop, test, deploy, monitor, and improve – you are responsible for the full lifecycle of your product. Your Skills and Experience You will be a perfect match if your profile ticks some of the items below: Must-have: A pragmatic mindset. Outstanding problem-solving ability, eagerness to learn, and curiosity. +5 years of software development experience with one or more general-purpose programming languages (Java or Python). Strong database and schema design skills for large-scale applications. Adaptable attitude and personality, ready for continuous change. Collaboration and culture fit in an Agile environment. Good English skills. Nice to have: Experience developing distributed systems using microservices architecture, serverless architecture, and event-driven architecture. Experience with Java, Spring Boot, Kafka, Redis, Python (e.g., Django, Flask, FastAPI), or similar technologies is a plus. Experience with AWS, Ansible, Packer, Docker, and Kubernetes is a significant plus. Experience with automated testing frameworks. Strong English listening and speaking skills. Experience working in the banking and financial domain. Why You'll Love Working Here You’ll love working with us if you are: Passionate about technology. Independent but also a good team player. Comfortable with a high degree of ambiguity. Focused on usability and speed. Keen on presenting your ideas to your peers and management. At GoTymeX, opportunities are here for the taking. If you want to be part of our purpose and live and lead through our values, we can offer exciting development opportunities through expanded lateral roles, stretch assignments, or people leadership. Some of our benefits: Meal and parking allowances are covered by the company. Full benefits and salary rank during probation . Insurances such as Vietnamese labor law and premium health care for you and your family. 13th-month salary pro-rata. Performance-based bonus and equity participation in GoTyme Group. SMART goals and clear career opportunities (technical seminar, conference, and career talk) - we focus on your development. Values-driven, international working environment, and agile culture. Overseas travel opportunities for training and work-related purposes. Internal Hackathons and company events (team building, coffee run, etc.). 15-day annual + 3-day sick leave + 1 birthday leave + 1 Christmas leave per year from the company. Work-life balance 40-hr per week from Mon to Fri .",2026-06-30T09:03:39.017800+00:00,ok,2026-06-22,2026-06-22,2026-07-27,"Ho Chi Minh, Ha Noi, Da Nang",senior,hybrid,full_time,month
itviec,https://itviec.com/it-jobs/software-engineer-azure-python-net-angular-rosenxt-technology-vietnam-5908,itviec_software-engineer-azure-python-net-angular-rosenxt-technology-vietnam-5908,"Software Engineer (Azure,Python/.NET, Angular)",ROSENXT TECHNOLOGY VIETNAM,Hồ Chí Minh,You'll love it,,,,"Cloud, English, Python, .NET, Angular, Azure, React, AWS, DevOps",,,,"Top 3 Reasons To Join Us We foster engineering culture Open-minded and enabling environment Opportunities to discover different career paths The Job As part of the global Rosenxt group, Rosenxt Vietnam is a dynamic technology company that focuses on advanced software and engineering solutions. The office is home to a young, energetic team of IT professionals who are passionate about innovation and continuous learning. Applying their skills, knowledge, and experience to deliver high-quality solutions that create value for the company and its global partners. With a collaborative and innovative working environment, Rosenxt Vietnam encourages creativity, teamwork, and professional growth. Location: Ung Van Khiem str, Thanh My Tay ward, HCMC. What you can expect Design and develop robust software solutions on Microsoft Azure for processing large sensor data, ensuring scalability and maintainability Own team-level architecture and product solutions, influencing related teams on certain projects Define and implement innovative technological solutions to complex business problems Independently code and design, with guidance on overall architecture when needed Develop, test, deploy, and operate software, delivering high-quality production code Clarify requirements, review code, provide constructive direction, and mitigate immediate risks Significantly impact the software quality and user experience of the product and its features Your Skills and Experience To become part of the ROSENXT family , you convince through analytical thinking and a structured and results-oriented working method. Moreover, you should bring with you: At least 6-year++ experience in cloud-based web application development. Good command of English (equivalent to C1) Desirable: Strong foundation of object-oriented programming, design & architectural patterns (especially microservice architecture) Experience with DevOps & container technology. Hands-on experience with cloud ( Azure , AWS, or GDP) Equivalent of at least 5-year++ experience with at least one back-end technology stack ( Python/.NET , Entity framework/Hibernate,…) Equivalent of at least 1-year++ experience with at least one front-end technology stack ( Angular /React, Selenium, Jasmine, Bootstrap, etc.) Experience with AI-assisted software development Preferable: Strong foundation of and enthusiasm in product and process management. Have experience in leading small software development team Experience working in an Agile team environment. We expect you to work independently and have high degrees of willingness to learn. Critical thinking but open-minded Why You'll Love Working Here Development opportunities and career opportunities in a global, innovative and long-term oriented group of companies with family character Flexible working time and Home Office possible An open, informal corporate culture, where we celebrate success with social events Various sports activities Salary on probation: competitive Capital accumulation benefits. Flextime accounts for all employees Employer-funded pension Health Insurance full 100% Insurance for Family 13th month salary Travel opportunities Well-being & work-life balance: staying healthy through comprehensive health plans for family. Statutory Compliance: Labor compliance with local regulations that ensure employee security. Work Facilities: top-notch equipment, and A-class facilities. Diversity, Equity, Engagement, & Inclusion: Becoming part of a global team that celebrates differences, equal opportunity, and meaningful employee recognition. Growth & Rewards: Thriving professionally through employee enablement, a culture of trust, and rewarding performance.",2026-06-30T09:03:41.907910+00:00,ok,2026-06-15,2026-06-15,2026-07-20,"Ho Chi Minh, Ha Noi, Da Nang",,remote,full_time,month
itviec,https://itviec.com/it-jobs/ai-software-engineer-python-go-c-c-ai-agents-mb-bank-1349,itviec_ai-software-engineer-python-go-c-c-ai-agents-mb-bank-1349,AI Software Engineer (Python/Go/C/C++ & AI Agents),MB Bank,Hà Nội,You'll love it,,,,"Python, FastAPI, Docker, Go, AI, C++, Kubernetes, PostgreSQL, MongoDB",fresher,0,1,"Top 3 Reasons To Join Us Mức lương cạnh tranh, hấp dẫn Môi trường làm việc chuyên nghiệp, thân thiện Được làm việc với các hệ thống hiện đại, tiên tiến The Job 2026TD450888 - AI Software Engineer (Python/Go/C/C++ Backend & AI Agents) Xây dựng phát triển các sản phẩm AI có khả năng tự động lập kế hoạch, ra quyết định và thực thi hành động, được triển khai thực tế ở quy mô lớn, các hệ thống AI thế hệ mới như: - AI Agents (Autonomous Agents) - LLM-powered Applications - Multi-agent Workflow Systems - AI-driven Backend Services - Intelligent Automation Platforms Trách nhiệm công việc (Responsibilities): - Thiết kế và phát triển các hệ thống Backend tích hợp AI/LLM Agents. - Xây dựng các Agentic Workflow, A: Planning – Tool Use – Memory – Execution. - Phát triển các dịch vụ AI dưới dạng Microservices (FastAPI/Flask/Django hoặc Java/Go services). - Tích hợp các mô hình AI vào hệ thống sản phẩm qua REST/gRPC APIs. - Triển khai hệ thống AI production-ready với Docker/Kubernetes. - Tối ưu hiệu năng inference: latency, throughput, cost. - Làm việc với dữ liệu lớn và hệ thống có lượng người dùng cao (đặc biệt trong tài chính/ngân hàng/chứng khoán). - Nghiên cứu và ứng dụng các kỹ thuật mới: RAG, Function Calling, Multi-agent systems, Reinforcement Learning Agents. - Đảm bảo các tiêu chuẩn về bảo mật, an toàn và khả năng mở rộng của hệ thống AI. Your Skills and Experience Tốt nghiệp Đại học các chuyên ngành: Công nghệ thông tin, Khoa học máy tính,Công nghệ phần mềm, Hệ thống thông tin, Tự động hóa, Điện tử viễn thông hoặc các ngành liên quan Có kinh nghiệm thực tế làm Backend tại công ty hoặc dự án lớn. Thành thạo ít nhất 1 ngôn ngữ Backend: Ưu tiên Python, Go, C/C++ Có kinh nghiệm thiết kế hệ thống Microservice Architecture. Thành thạo một trong các hệ quản trị cơ sở dữ liệu:PostgreSQL, MongoDB... Hiểu rõ API design (RESTful/gRPC), bảo mật và tối ưu hiệu năng hệ thống. Có kinh nghiệm với: LLM Agents (GPT, Gemini, Claude...), LangChain / LangGraph/ ADK, Autogen, RAG pipelines, Vector Database(Milvus, pgvector...). Tool-use Agents (Function Calling), Memory + Planning + Multi-step reasoning systems Thành thạo Git/GitFlow Có kinh nghiệm: Docker, Kubernetes... Ưu tiên: + Có kinh nghiệm trong domain: Tài chính, ngân hàng, chứng khoán + Hiểu biết về AI Safety, Guardrails, Model Monitoring. + Có kinh nghiệm tối ưu hệ thống AI cost-efficient ở production. + Với ứng viên Junior, Fresher: Ưu tiên các bạn xếp loại học tập loại Giỏi, Xuất sắc; GPA cao; đạt giải thưởng trong các cuộc thi chuyên môn, học sinh giỏi tỉnh, thành phố trở lên; có nghiên cứu khoa học được công bố tại các hội thảo, tạp chí quốc tế (ứng viên cần thể hiện nội dung về GPA, giải thưởng trong CV) + Có kiến thức, Kỹ thuật xử lý dữ liệu:NLP, Computer Vision, Speech, Video Understanding + Hiểu biết kiến trúc mô hình: CNN, RNN, Transformer, Attention, GNN… MB Bank yêu cầu ứng viên ứng tuyển cần cung cấp chi tiết các thông tin sau: - Thông tin cá nhân: Họ và tên, Ngày tháng năm sinh, Giới tính - Số điện thoại và Email liên hệ - Trình độ học vấn, Trường đã tốt nghiệp - Kinh nghiệm làm việc - Từ 3 - 5 kỹ năng nổi bật - Nguồn Tuyển dụng Vì sao Bạn nên đảm bảo đầy đủ thông tin khi ứng tuyển? - Hồ sơ của Bạn sẽ được đánh giá nhanh chóng. - Đối với các hồ sơ đáp ứng đầy đủ thông tin và tiêu chí tuyển dụng phù hợp, MB Bank sẽ chủ động liên hệ phỏng vấn trong thời gian sớm nhất. - Ứng viên vui lòng kiểm tra email và điện thoại thường xuyên để không bỏ lỡ lịch hẹn phỏng vấn Cập nhật ngay thông tin mới nhất về các Chương trình do MB tổ chức tại FanPage: - Ai yêu Miền Bắc hơn MBers - Ai yêu Miền Trung hơn MBers - Ai yêu Miền Nam hơn MBers Why You'll Love Working Here Trải nghiệm Thu nhập hấp dẫn với gói đãi ngộ toàn diện: Thưởng thành tích tháng 13; Thưởng thành tích theo kết quả công việc 06 tháng, 1 năm ; Thưởng các dịp lễ tết trong năm ; Thưởng theo danh hiệu cá nhân và tập thể… Du lịch nghỉ dưỡng hàng năm Khám sức khỏe định kì Gói bảo hiểm sức khỏe cá nhân và người thân (MIC) Quà tặng và ngày nghỉ sinh nhật hưởng nguyên lương Cơ hội nghề nghiệp và phát triển bản thân: Được thử sức với các nền tảng công nghệ mới, tham gia vào những dự án chuyển đổi lớn của ngân hàng Có cơ hội học hỏi từ các Chuyên gia, Lãnh đạo nội bộ hàng đầu tại MB trong lĩnh vực IT, Tài chính ngân hàng Được trải nghiệm các phương pháp học tập mới và phát triển năng lực theo lộ trình công danh. Hưởng các chính sách hỗ trợ, khuyến khích học tập, nâng cao trình độ và phát triển bản thân (chứng chỉ nghề quốc tế...) Môi trường làm việc lý tưởng với: Những người cộng sự thân thiện và tài năng Cơ sở vật chất, không gian làm việc xanh và hiện đại.",2026-06-30T09:03:46.019962+00:00,ok,2026-06-19,2026-06-19,2026-07-24,"Ho Chi Minh, Ha Noi, Da Nang",junior,onsite,full_time,month
itviec,https://itviec.com/it-jobs/agentic-engineer-python-go-c-c-backend-ai-agents-mb-bank-1315,itviec_agentic-engineer-python-go-c-c-backend-ai-agents-mb-bank-1315,Agentic Engineer (Python/Go/C/C++ Backend & AI Agents),MB Bank,Hà Nội,You'll love it,,,,"Python, FastAPI, Go, AI, C language, C++, Docker, Kubernetes, PostgreSQL, MongoDB",fresher,0,1,"Top 3 Reasons To Join Us Mức lương cạnh tranh, hấp dẫn Môi trường làm việc chuyên nghiệp, thân thiện Được làm việc với các hệ thống hiện đại, tiên tiến The Job 2026TD450887 - Agentic Engineer (Python/Go/C/C++ Backend & AI Agents) Xây dựng phát triển các sản phẩm AI có khả năng tự động lập kế hoạch, ra quyết định và thực thi hành động, được triển khai thực tế ở quy mô lớn, các hệ thống AI thế hệ mới như: - AI Agents (Autonomous Agents) - LLM-powered Applications - Multi-agent Workflow Systems - AI-driven Backend Services - Intelligent Automation Platforms Trách nhiệm công việc (Responsibilities): - Thiết kế và phát triển các hệ thống Backend tích hợp AI/LLM Agents. - Xây dựng các Agentic Workflow, A: Planning – Tool Use – Memory – Execution. - Phát triển các dịch vụ AI dưới dạng Microservices (FastAPI/Flask/Django hoặc Java/Go services). - Tích hợp các mô hình AI vào hệ thống sản phẩm qua REST/gRPC APIs. - Triển khai hệ thống AI production-ready với Docker/Kubernetes. - Tối ưu hiệu năng inference: latency, throughput, cost. - Làm việc với dữ liệu lớn và hệ thống có lượng người dùng cao (đặc biệt trong tài chính/ngân hàng/chứng khoán). - Nghiên cứu và ứng dụng các kỹ thuật mới: RAG, Function Calling, Multi-agent systems, Reinforcement Learning Agents. - Đảm bảo các tiêu chuẩn về bảo mật, an toàn và khả năng mở rộng của hệ thống AI. Your Skills and Experience Tốt nghiệp Đại học các chuyên ngành: Công nghệ thông tin, Khoa học máy tính, Công nghệ phần mềm, Hệ thống thông tin, Tự động hóa, Điện tử viễn thông hoặc các ngành liên quan Có kinh nghiệm thực tế làm Backend tại công ty hoặc dự án lớn. Thành thạo ít nhất 1 ngôn ngữ Backend: Ưu tiên Python, Go, C/C++ Có kinh nghiệm thiết kế hệ thống Microservice Architecture. Thành thạo một trong các hệ quản trị cơ sở dữ liệu:PostgreSQL, MongoDB... Hiểu rõ API design (RESTful/gRPC), bảo mật và tối ưu hiệu năng hệ thống. Có kinh nghiệm với: LLM Agents (GPT, Gemini, Claude...), LangChain / LangGraph/ ADK, Autogen, RAG pipelines, Vector Database(Milvus, pgvector...). Tool-use Agents (Function Calling), Memory + Planning + Multi-step reasoning systems Thành thạo Git/GitFlow Có kinh nghiệm: Docker, Kubernetes... Ưu tiên: + Có kinh nghiệm trong domain: Tài chính, ngân hàng, chứng khoán + Hiểu biết về AI Safety, Guardrails, Model Monitoring. + Có kinh nghiệm tối ưu hệ thống AI cost-efficient ở production. + Với ứng viên Junior, Fresher: Ưu tiên các bạn xếp loại học tập loại Giỏi, Xuất sắc; GPA cao; đạt giải thưởng trong các cuộc thi chuyên môn, học sinh giỏi tỉnh, thành phố trở lên; có nghiên cứu khoa học được công bố tại các hội thảo, tạp chí quốc tế (ứng viên cần thể hiện nội dung về GPA, giải thưởng trong CV) + Có kiến thức, Kỹ thuật xử lý dữ liệu:NLP, Computer Vision, Speech, Video Understanding + Hiểu biết kiến trúc mô hình: CNN, RNN, Transformer, Attention, GNN… MB Bank yêu cầu ứng viên ứng tuyển cần cung cấp chi tiết các thông tin sau: - Thông tin cá nhân: Họ và tên, Ngày tháng năm sinh, Giới tính - Số điện thoại và Email liên hệ - Trình độ học vấn, Trường đã tốt nghiệp - Kinh nghiệm làm việc - Từ 3 - 5 kỹ năng nổi bật - Nguồn Tuyển dụng Vì sao Bạn nên đảm bảo đầy đủ thông tin khi ứng tuyển? - Hồ sơ của Bạn sẽ được đánh giá nhanh chóng. - Đối với các hồ sơ đáp ứng đầy đủ thông tin và tiêu chí tuyển dụng phù hợp, MB Bank sẽ chủ động liên hệ phỏng vấn trong thời gian sớm nhất. - Ứng viên vui lòng kiểm tra email và điện thoại thường xuyên để không bỏ lỡ lịch hẹn phỏng vấn Cập nhật ngay thông tin mới nhất về các Chương trình do MB tổ chức tại FanPage: - Ai yêu Miền Bắc hơn MBers - Ai yêu Miền Trung hơn MBers - Ai yêu Miền Nam hơn MBers Why You'll Love Working Here Trải nghiệm Thu nhập hấp dẫn với gói đãi ngộ toàn diện: Thưởng thành tích tháng 13; Thưởng thành tích theo kết quả công việc 06 tháng, 1 năm ; Thưởng các dịp lễ tết trong năm ; Thưởng theo danh hiệu cá nhân và tập thể… Du lịch nghỉ dưỡng hàng năm Khám sức khỏe định kì Gói bảo hiểm sức khỏe cá nhân và người thân (MIC) Quà tặng và ngày nghỉ sinh nhật hưởng nguyên lương Cơ hội nghề nghiệp và phát triển bản thân: Được thử sức với các nền tảng công nghệ mới, tham gia vào những dự án chuyển đổi lớn của ngân hàng Có cơ hội học hỏi từ các Chuyên gia, Lãnh đạo nội bộ hàng đầu tại MB trong lĩnh vực IT, Tài chính ngân hàng Được trải nghiệm các phương pháp học tập mới và phát triển năng lực theo lộ trình công danh. Hưởng các chính sách hỗ trợ, khuyến khích học tập, nâng cao trình độ và phát triển bản thân (chứng chỉ nghề quốc tế...) Môi trường làm việc lý tưởng với: Những người cộng sự thân thiện và tài năng Cơ sở vật chất, không gian làm việc xanh và hiện đại.",2026-06-30T09:03:48.858747+00:00,ok,2026-06-19,2026-06-19,2026-07-24,"Ho Chi Minh, Ha Noi, Da Nang",junior,onsite,full_time,month
itviec,https://itviec.com/it-jobs/senior-fullstack-engineer-nodejs-java-react-python-fpt-digital-1336,itviec_senior-fullstack-engineer-nodejs-java-react-python-fpt-digital-1336,"Senior Fullstack Engineer (NodeJS, Java, React, Python)",FPT Digital,Hà Nội,You'll love it,,,,"Node.js, NextJS, .NET, Python, React, Java, AWS, Azure, GCP",4+ years,4,,"Top 3 Reasons To Join Us The Job We are looking for engineers who want to build the entire experience of an AI product — from how users ask questions, how the AI processes data, to how insights are displayed and drive business decisions. If you prefer building products over building features, come create the Sales Intelligence Platform with us. Design and develop core features of the Sales Intelligence Platform Build user experiences for AI features such as: AI Assistant, Customer Intelligence, Opportunity Discovery, Knowledge Search, Sales Recommendation Develop frontend and backend for AI-native products Integrate AI services, data, and enterprise systems Work alongside the Product Owner, Solution Architect, Tech Lead, and AI Engineers to bring the product from concept to real-world deployment Contribute to architectural design, source code quality, and system performance Your Skills and Experience Must have : 4+ years of experience in software development Experience building modern web applications Proficient in frontend frameworks like React, Next.js, or equivalent Proficient in backend with NodeJS, Java, .NET, or Python Understanding of REST APIs, Authentication, Databases, and Cloud Services Strong product mindset and problem-solving skills Preferred Qualifications (Nice-to-have) Prior experience building SaaS or Enterprise Products Experience integrating AI/LLM APIs Understanding of GenAI, RAG, or AI Agents Experience with Azure, AWS, or GCP Interest in Product Thinking and User Experience Why You'll Love Working Here Benefits Participate in building an AI-native product from its very first versions Work directly with the latest AI technologies Own products and features end-to-end Fast-paced, flat environment with high autonomy Opportunity to grow into a Staff Engineer, Solution Architect, or AI Engineer role",2026-06-30T09:03:52.974409+00:00,ok,2026-06-19,2026-06-19,2026-07-24,"Ho Chi Minh, Ha Noi, Da Nang",senior,onsite,full_time,
